kiscourseid,url,degree_type,degree_title,a_level_grade_req,a_level_subject_reqs,ib_grade_req,ib_subject_req
K0233,https://www.birmingham.ac.uk/undergraduate/courses/govsoc/international-relations.aspx,BA,International Relations,AAB,AAB,32,"6,6,5 at Higher Level with a minimum of 32 points overall"
K0235,https://www.birmingham.ac.uk/undergraduate/courses/physics/physics-astrophysics-international-bsc.aspx,BSc,Physics and Astrophysics (International Study),A*AA,A*AA /AAAA to include A-level Mathematics and A-level Physics grades A*A (or AA as part of the four A level offer). GCSE Grade 6 in relevant language to study abroad.,32,"7,6,6  at HL, to include Mathematics and Physics, with a minimum of 32 points overall. 7 must be in Mathematics or Physics."
K0249,https://www.birmingham.ac.uk/undergraduate/courses/histart/history-art.aspx,BA,History of Art,ABB,ABB,32,"6,5,5 including 32 points overall."
K0257,https://www.birmingham.ac.uk/undergraduate/courses/chemistry/chemistry-study-abroad-msci.aspx,MSci,Chemistry with Study Abroad,A*AA,A*AA  - AAA to include A-level Chemistry. Minimum Maths requirement: GCSE grade 6.,32,"7,6,6 - 6,6,6  at Higher Level, including Chemistry at Higher Level, with a minimum of 32 points overall. Further information below."
K0258,https://www.birmingham.ac.uk/undergraduate/courses/chemistry/chemistry-business-bsc.aspx,BSc,Chemistry with Business Management,AAA,"AAA  - AAB to include A-level Chemistry, minimum Maths requirement GCSE grade 6.",32,"6,6,6 - 6,6,5  at Higher Level, including Chemistry at Higher Level, with a minimum of 32 points overall. Further information below."
K0259,https://www.birmingham.ac.uk/undergraduate/courses/chemistry/chemistry-business-msci.aspx,MSci,Chemistry with Business Management,A*AA,A*AA  - AAA to include A-level Chemistry. Minimum Maths requirement: GCSE grade 6.,32,"7,6,6 - 6,6,6  at Higher Level, including Chemistry at Higher Level, with a minimum of 32 points overall. Further information below."
K0260,https://www.birmingham.ac.uk/undergraduate/courses/social-policy/social-work.aspx,BA,Social Work,,"6,5,5 at Higher Level, to include English with a minimum of 32 points overall.",,"BTEC Extended Diploma, Diploma and Subsidiary Diploma are all considered.considered"
K0262,https://www.birmingham.ac.uk/undergraduate/courses/edu/ba-education.aspx,BA,Education,ABB,ABB,32,"6,5,5 32 points overall"
K0270,https://www.birmingham.ac.uk/undergraduate/courses/law/law-business.aspx,LLB,Law with Business Studies,AAA,AAA,32,"6,6,6 including 32 points overall."
K0272,https://www.birmingham.ac.uk/undergraduate/courses/business/business-management.aspx,BSc,Business Management,,"6,6,5 32 points overall",,"DDD in Business, Applied Science, or Enterprise and Entrepreneurship"
K0273,https://www.birmingham.ac.uk/undergraduate/courses/business/business-mgmt-comms.aspx,BSc,Business Management with Communications,,"6,6,5 32 points overall",,"DDD in Business, Applied Science, or Enterprise and Entrepreneurship"
K0275,https://www.birmingham.ac.uk/undergraduate/courses/business/international-business-comms.aspx,BSc,International Business with Communications,,"6,6,5 32 points overall",,"DDD in Business, Applied Science, or Enterprise and Entrepreneurship"
K0276,https://www.birmingham.ac.uk/undergraduate/courses/business/bus-mgnt-year-in-industry.aspx,BSc,Business Management with Year in Industry,,"6,6,5 32 points overall",,"DDD in Business, Applied Science, or Enterprise and Entrepreneurship"
K0277,https://www.birmingham.ac.uk/undergraduate/courses/business/international-business-lang.aspx,BSc,International Business with Language,,"6,6,5 32 points overall. To include 5 at HL in language for Advanced levels.",,"BTEC National Extended Diploma DDD in Business, Applied Science, or Enterprise and Entrepreneurship. Plus A level grade B in relevant language for Advanced level options."
K0278,https://www.birmingham.ac.uk/undergraduate/courses/business/international-business.aspx,BSc,International Business,,"6,6,5 32 points overall",,"DDD in Business, Applied Science, or Enterprise and Entrepreneurship"
K0279,https://www.birmingham.ac.uk/undergraduate/courses/metallurgy-materials/materials-engineering-industrial-meng.aspx,MEng,Materials Science and Engineering with Industrial Experience,AAA,"AAA to include A-level Mathematics and one of Physics, Chemistry or Design and Technology.",32,"6,6,6 at Higher Level, including Mathematics and either Physics, Design Technology or Chemistry, with a minimum of 32 points overall."
K0282,https://www.birmingham.ac.uk/undergraduate/courses/lang/mod-lang-business.aspx,BA,Modern Languages with Business Management,AAB,"AAB A level grade B is required for the advanced language you wish to study. It is also possible to study two beginner (including post-GCSE) languages without taking an advanced language, as long as one of your beginner languages is French or Spanish.",32,"6,6,5 32 points overall. You also require a Higher Level or equivalent in each modern language that you plan to study."
K0283,https://www.birmingham.ac.uk/undergraduate/courses/english/english-creative.aspx,BA,English Literature and Creative Writing,AAB,AAB to include A level English Literature or English Language and Literature.,32,"6,6,5 32 points overall (to include HL English Literature or English Language and Literature)."
K0287,https://www.birmingham.ac.uk/undergraduate/courses/history/history.aspx,BA,History,AAB,"AAB to include History, Medieval History or Ancient History. ",32,"6,6,5 32 points overall."
K0288,https://www.birmingham.ac.uk/undergraduate/courses/maths/mathematics-MSci.aspx,MSci,Mathematics,A*AA,A*AA to include A-level grade A in Mathematics or Further Mathematics.,32,"7,6,6 at Higher Level, including a 6 in Mathematics, with a minimum of 32 points overall."
K0289,https://www.birmingham.ac.uk/undergraduate/courses/maths/mathematics.aspx,BSc,Mathematics,AAA,AAA to include A-level grade A in Mathematics or Further Mathematics.,32,"6,6,6 at Higher Level, including Mathematics, with a minimum of 32 points overall."
K0290,https://www.birmingham.ac.uk/undergraduate/courses/maths/mathematics-europe.aspx,BSc,Mathematics with Study in Continental Europe,AAA,AAA to include A-level grade A in Mathematics or Further Mathematics.,32,"6,6,6 at Higher Level, including Mathematics, with a minimum of 32 points overall."
K0291,https://www.birmingham.ac.uk/undergraduate/courses/chemistry/chemistry-bsc.aspx,BSc,Chemistry,AAA,"AAA  - AAB to include A-level Chemistry, minimum Maths requirement GCSE grade 6.",32,"6,6,6 - 6,6,5  at Higher Level, including Chemistry at Higher Level, with a minimum of 32 points overall. Further information below."
K0292,https://www.birmingham.ac.uk/undergraduate/courses/chemistry/chemistry-msci.aspx,MSci,Chemistry,A*AA,A*AA  - AAA to include A-level Chemistry. Minimum Maths requirement: GCSE grade 6.,32,"7,6,6 - 6,6,6  at Higher Level, including Chemistry at Higher Level, with a minimum of 32 points overall. Further information below."
K0295,https://www.birmingham.ac.uk/undergraduate/courses/chemistry/chemistry-industrial.aspx,MSci,Chemistry with a Year in Industry,A*AA,A*AA  - AAA to include A-level Chemistry. Minimum Maths requirement: GCSE grade 6.,32,"7,6,6 - 6,6,6  at Higher Level, including Chemistry at Higher Level, with a minimum of 32 points overall. Further information below."
K0296,https://www.birmingham.ac.uk/undergraduate/courses/biosciences/biochemistry-msci.aspx,MSci,Biochemistry,AAA,AAA To include Chemistry + 1 from Maths / Further Maths / Statistics / Biology / Physics ,32,"6,6,6 + 1 from Maths: Analysis and Approaches / Maths: Applications and Interpretation/ Statistics / Biology / Physics  at Higher Level with a minimum of 32 points overall"
K0298,https://www.birmingham.ac.uk/undergraduate/courses/biosciences/biological-sciences-msci.aspx,MSci,Biological Sciences,AAA,AAA including Biology / Human Biology + 1 from Chemistry / Physics / Maths / Further Maths / Statistics / Geology / Geography / Psychology,,"6,6,6 including Biology / Human Biology + 1 from Chemistry / Physics / Maths: Analysis and Approaches / Maths: Applications and Interpretation/ Statistics / Geology / Geography / Psychology "
K0313,https://www.birmingham.ac.uk/undergraduate/courses/caha/arch-anthropology.aspx,BA,Social Anthropology and Archaeology,ABB,ABB,32,"6,5,5 including 32 points overall. "
K0316,https://www.birmingham.ac.uk/undergraduate/courses/jointhonours/english-and-history-of-art.aspx,BA,English Literature and History of Art,ABB,ABB to include English Literature or English Language and Literature.,32,"6,5,5 32 points overall."
K0318,https://www.birmingham.ac.uk/undergraduate/courses/jointhonours/english-and-classical-literature-and-civilisation.aspx,BA,English Literature and Classical Literature & Civilisation,ABB,ABB to include English Literature/English Literature and Language.,32,"6,5,5 including 32 points overall. See below for full information."
K0325,https://www.birmingham.ac.uk/undergraduate/courses/jointhonours/english-literature-and-history.aspx,BA,English Literature and History,AAB,AAB including A level English Literature or English Language and Literature. See below for full information.,32,"6,6,5 including a 5 in English and 32 points overall. See below for full information."
K0331,https://www.birmingham.ac.uk/undergraduate/courses/jointhonours/english-literature-and-philosophy.aspx,BA,English Literature and Philosophy,AAB,AAB including English Literature or English Language and Literature.,,"6,6,5 see below for full information."
K0336,https://www.birmingham.ac.uk/undergraduate/courses/mechanical-engineering/mechanical-engineering-automotive-beng.aspx,BEng,Mechanical Engineering (Automotive),AAB,AAB to include A-level Mathematics. Further Mathematics and Physics are not required but are advantageous.,32,"6,6,5 at Higher Level (including Mathematics) with 32 points overall."
K0337,https://www.birmingham.ac.uk/undergraduate/courses/mechanical-engineering/mechanical-engineering-automotive-meng.aspx,MEng,Mechanical Engineering (Automotive),AAA,AAA to include A-level Mathematics. Further Mathematics and Physics are not required but are advantageous.,32,"6,6,6 at Higher Level (including Mathematics) with 32 points overall."
K0341,https://www.birmingham.ac.uk/undergraduate/courses/sportex/sport-pe-coaching-bp.aspx,BSc,"Sport, PE and Coaching Science",AAB,AAB - ABB dependent on the number of preferred subjects included,32,"6,6,5 - 6,5,5 in Higher level subjects plus 32 points overall, dependent on the number of preferred subjects as defined for the A-level qualification."
K0344,https://www.birmingham.ac.uk/undergraduate/courses/jointhonours/drama-and-english.aspx,BA,Drama and English Literature,AAB,AAB to include A level English Literature or equivalent.,32,"6,6,5 including 32 points overall."
K0351,https://www.birmingham.ac.uk/undergraduate/courses/english/english-lang.aspx,BA,English Language and Linguistics,AAB,AAB - ABB See below for full information.,32,"6,6,5 including 32 points overall."
K0352,https://www.birmingham.ac.uk/undergraduate/courses/gees/geography-bsc-abroad.aspx,BSc,Geography with Year Abroad,AAB,AAB,32,"6,6,5 32 points overall."
K0353,https://www.birmingham.ac.uk/undergraduate/courses/gees/geography-ba-abroad.aspx,BA,Geography with Year Abroad,AAB,AAB,32,"6,6,5 32 points overall."
K0355,https://www.birmingham.ac.uk/undergraduate/courses/psychology/psychology-practice.aspx,MSci,Psychology and Psychological Practice,A*AA,A*AA including Chemistry / Biology / Human Biology / Physics / Psychology / Maths / Further Maths / Statistics,32,"7,6,6  at Higher Level with a minimum of 32 points overall"
K0357,https://www.birmingham.ac.uk/undergraduate/courses/govsoc/international-relations-economics.aspx,BA,International Relations with Economics,AAB,AAB,32,"6,6,5 at Higher Level with a minimum of 32 points overall"
K0358,https://www.birmingham.ac.uk/undergraduate/courses/govsoc/politics-international-relations.aspx,BA,Politics and International Relations,AAB,AAB,32,"6,6,5 at Higher Level with a minimum of 32 points overall"
K0359,https://www.birmingham.ac.uk/undergraduate/courses/govsoc/international-relations-french.aspx,BA,International Relations with French,AAB,AAB and including at least a B in French,32,"6,6,5 at Higher Level with a minimum of 32 points overall"
K0360,https://www.birmingham.ac.uk/undergraduate/courses/govsoc/international-relations-german.aspx,,,,,,
K0361,https://www.birmingham.ac.uk/undergraduate/courses/govsoc/international-relations-spanish.aspx,BA,International Relations with Spanish,AAB,AAB and including at least a B in Spanish,32,"6,6,5 at Higher Level with a minimum of 32 points overall"
K0364,https://www.birmingham.ac.uk/undergraduate/courses/chemical-engineering/chemical-engineering-industry-beng.aspx,BEng,Chemical Engineering with Industrial Study,AAA,AAA to include A-level Mathematics and Chemistry or Physics.,32,"6,6,6 at Higher Level including Mathematics and Chemistry or Physics at Higher Level grade 6 with a minimum of 32 points overall.  We will consider Standard Level Mathematics grade 7."
K0367,https://www.birmingham.ac.uk/undergraduate/courses/chemical-engineering/chemical-engineering-industrial-international-meng.aspx,MEng,Chemical Engineering with International and Industrial Study,A*AA,A*AA /AAAA to include A-level Mathematics and Chemistry or Physics.,32,"7,6,6 at HL, to include Mathematics and Chemistry or Physics HL grade 6 with a minimum of 32 points overall. We will consider Standard Level Maths grade 7."
K0368,https://www.birmingham.ac.uk/undergraduate/courses/maths/maths-computer-science-industrial.aspx,BSc,Mathematics and Computer Science with Industrial Year,A*AA,A*AA to include A-level grade A in Mathematics or Further Mathematics.,32,"7,6,6 at Higher Level, including Mathematics, with a minimum of 32 points overall."
K0369,https://www.birmingham.ac.uk/undergraduate/courses/maths/maths-computer-science-industrial-msci.aspx,MSci,Mathematics and Computer Science with Industrial Year,A*AA,A*AA to include A-level grade A in Mathematics or Further Mathematics.,32,"7,6,6 at Higher Level, including a 6 in Mathematics, with a minimum of 32 points overall."
K0372,https://www.birmingham.ac.uk/undergraduate/courses/computer-science/computer-science-industry.aspx,BSc,Computer Science with a Year in Industry,A*AA,A*AA to include A-level Mathematics grade A.,32,"7,6,6 at Higher Level to include 6 in Mathematics, with a minimum of 32 points overall. We also require 5 in Standard Level English."
K0373,https://www.birmingham.ac.uk/undergraduate/courses/computer-science/artificial-intelligence-computer-science-industry.aspx,BSc,Artificial Intelligence (AI) and Computer Science with a Year in Industry,A*AA,A*AA to include A-level Mathematics grade A.,32,"7,6,6 at Higher Level to include 6 in Mathematics, with a minimum of 32 points overall. We also require 5 in Standard Level English."
K0375,https://www.birmingham.ac.uk/undergraduate/courses/eese/electronic-electrical-engineering-industry-beng.aspx,BEng,Electronic and Electrical Engineering with Industrial Year,AAB,AAB to include A-level Mathematics.,32,"6,6,5 at Higher Level (including Mathematics) with 32 points overall."
K0382,https://www.birmingham.ac.uk/undergraduate/courses/eese/electronic-electrical-engineering-industry-meng.aspx,MEng,Electronic and Electrical Engineering with Industrial Year,AAA,AAA to include A-level Mathematics.,32,"6,6,6 at Higher Level (including Mathematics) with 32 points overall."
K0386,https://www.birmingham.ac.uk/undergraduate/courses/mechanical-engineering/mechanical-engineering-industrial-meng.aspx,MEng,Mechanical Engineering with Industrial Year,AAA,AAA to include A-level Mathematics. Further Mathematics and Physics are not required but are advantageous.,32,"6,6,6 at Higher Level (including Mathematics) with 32 points overall."
K0404,https://www.birmingham.ac.uk/undergraduate/courses/computer-science/computer-science-software-engineering-industry.aspx,MEng,Computer Science/Software Engineering with a Year in Industry,A*AA,A*AA to include A-level Mathematics grade A.,32,"7,6,6 at Higher Level to include 6 in Mathematics, with a minimum of 32 points overall. We also require 5 in Standard Level English."
K0406,https://www.birmingham.ac.uk/undergraduate/courses/med/biomedical-science.aspx,BSc,Biomedical Science,AAB,"AAB  to include two science A levels, one from Biology or Chemistry plus another from Biology, Chemistry, Mathematics, Physics or Psychology",32,"6,6,5 at Higher Level, to include at least two sciences. 32 points overall."
K0410,https://www.birmingham.ac.uk/undergraduate/courses/govsoc/politics-social-policy.aspx,BA,Politics and Social Policy,AAB,AAB,32,"6,6,5 at Higher Level with a minimum of 32 points overall"
K0411,https://www.birmingham.ac.uk/undergraduate/courses/govsoc/politics-sociology.aspx,BA,Politics and Sociology,AAB,AAB,32,"6,6,5 at Higher Level with a minimum of 32 points overall"
K0412,https://www.birmingham.ac.uk/undergraduate/courses/gees/geography-msci.aspx,MSci,Geography,AAB,AAB,32,"6,6,5 32 points overall."
K0413,https://www.birmingham.ac.uk/undergraduate/courses/gees/geography-msci-international.aspx,MSci,Geography with International Year,AAB,AAB,32,"6,6,5 32 points overall."
K0416,https://www.birmingham.ac.uk/undergraduate/courses/med/pharmacy-4-year.aspx,MPharm,Pharmacy,AAB,"AAB  to include Chemistry and at least one further science at A level from Biology, Mathematics or Physics",32,"6,6,5 at Higher Level, including Chemistry plus either Biology, Physics or Maths and three further subjects at Standard Level. 32 points overall"
K0418,https://www.birmingham.ac.uk/undergraduate/courses/social-policy/policy-politics-economics.aspx,BA,"Policy, Politics and Economics",AAB,AAB to include GCSE Maths Grade A/7,32,"6,6,5 at Higher Level, to include English with a minimum of 32 points overall"
K0419,https://www.birmingham.ac.uk/undergraduate/courses/english/english-language-and-literature.aspx,BA,English Language and Literature,AAB,AAB see below for full information.,32,"6,6,5 including 32 points overall. See below for full information."
K0420,https://www.birmingham.ac.uk/undergraduate/courses/computer-science/computer-science-msci.aspx,MSci,Computer Science,A*AA,A*AA to include A-level Mathematics grade A.,32,"7,6,6 at Higher Level to include 6 in Mathematics, with a minimum of 32 points overall. We also require 5 in Standard Level English."
K0421,https://www.birmingham.ac.uk/undergraduate/courses/computer-science/computer-science-industry-msci.aspx,MSci,Computer Science with a Year in Industry,A*AA,A*AA to to include A-level Mathematics grade A.,32,"7,6,6 at Higher Level to include 6 in Mathematics, with a minimum of 32 points overall. We also require 5 in Standard Level English."
K0422,https://www.birmingham.ac.uk/undergraduate/courses/computer-science/computer-science-international-msci.aspx,MSci,Computer Science with Study Abroad,A*AA,A*AA to include A-level Mathematics grade A.,32,"7,6,6 at Higher Level to include 6 in Mathematics, with a minimum of 32 points overall. We also require 5 in Standard Level English."
K0424,https://www.birmingham.ac.uk/undergraduate/courses/edu/education-sociology.aspx,BA,Education and Sociology,ABB,ABB,32,"6,5,5 32 points overall"
K0435,https://www.birmingham.ac.uk/undergraduate/courses/computer-science/computer-science-international-bsc.aspx,BSc,Computer Science with Study Abroad,A*AA,A*AA to include A-level Mathematics grade A.,32,"7,6,6 at Higher Level to include 6 in Mathematics, with a minimum of 32 points overall. We also require 5 in Standard Level English."
K0439,https://www.birmingham.ac.uk/undergraduate/courses/govsoc/politics-philosophy-year-abroad.aspx,BA,Politics and Philosophy with year abroad,AAB,AAB,32,"6,6,5 at Higher Level with a minimum of 32 points overall"
K0440,https://www.birmingham.ac.uk/undergraduate/courses/govsoc/politics-social-policy-year-abroad.aspx,BA,Politics and Social Policy with Year Abroad,AAB,AAB,32,"6,6,5 at Higher Level with a minimum of 32 points overall"
K0441,https://www.birmingham.ac.uk/undergraduate/courses/govsoc/politics-sociology-year-abroad.aspx,BA,Politics and Sociology with Year Abroad,AAB,AAB,32,"6,6,5 at Higher Level with a minimum of 32 points overall"
K0442,https://www.birmingham.ac.uk/undergraduate/courses/govsoc/politics-year-abroad.aspx,BA,Politics with Year Abroad,AAB,AAB,32,"6,6,5 at Higher Level with a minimum of 32 points overall"
K0444,https://www.birmingham.ac.uk/undergraduate/courses/social-policy/social-policy-year-abroad-ba.aspx,BA,Social Policy with Year Abroad,ABB,ABB,32,"6,5,5 at Higher Level, to include English with a minimum of 32 points overall."
K0467,https://www.birmingham.ac.uk/undergraduate/courses/govsoc/international-relations-year-abroad.aspx,BA,International Relations with Year Abroad,AAB,AAB,32,"6,6,5 at Higher Level with a minimum of 32 points overall"
K0469,https://www.birmingham.ac.uk/undergraduate/courses/govsoc/international-relations-economics-year-abroad.aspx,BA,International Relations with Economics with year abroad,AAB,AAB,32,"6,6,5 at Higher Level with a minimum of 32 points overall"
K0470,https://www.birmingham.ac.uk/undergraduate/courses/govsoc/politics-international-relations-year-abroad.aspx,BA,Politics and International Relations with Year Abroad,AAB,AAB,32,"6,6,5 at Higher Level with a minimum of 32 points overall"
K0471,https://www.birmingham.ac.uk/undergraduate/courses/law/law-criminology.aspx,LLB,Law with Criminology,AAA,AAA,32,"6,6,6 in Higher level subjects plus 32 points overall."
K0485,https://www.birmingham.ac.uk/undergraduate/courses/thr/politics-religion-philosophy.aspx,BA,"Politics, Religion and Philosophy",AAB,AAB,32,"6,6,5 in Higher level subjects plus 32 points overall."
K0486,https://www.birmingham.ac.uk/undergraduate/courses/jointhonours/modern-languages-and-english-lit.aspx,BA,Modern Languages and English Literature,AAB,AAB English Literature or English Language and Literature is required. See below for full information.,32,"6,6,5 32 points overall. See below for full information."
K0487,https://www.birmingham.ac.uk/undergraduate/courses/jointhonours/modern-languages-and-history-of-art.aspx,BA,Modern Languages and History of Art,ABB,"ABB A level grade B is required for the advanced language you wish to study. It is also possible to study two beginner (including post-GCSE) languages without taking an advanced language, as long as one of your beginner languages is French or Spanish.",32,"6,5,5 32 points overall. You also require a Higher Level or equivalent in each modern language that you plan to study."
K0488,https://www.birmingham.ac.uk/undergraduate/courses/gees/geology-msci.aspx,MSci,Geology,AAB,AAB Including 1 Required Science,32,"6,6,5 32 points overall Including HL in 1 Required Science"
K0491,https://www.birmingham.ac.uk/undergraduate/courses/gees/geology-physical-geography-msci.aspx,MSci,Geology and Physical Geography,AAB,AAB Including 1 Required Science,32,"6,6,5 32 points overall."
K0494,https://www.birmingham.ac.uk/undergraduate/courses/social-policy/social-policy-and-criminology.aspx,BA,Social Policy and Criminology,ABB,ABB,32,"6,5,5 at Higher Level, to include English with a minimum of 32 points overall."
K0496,https://www.birmingham.ac.uk/undergraduate/courses/caha/classics.aspx,BA,Classics,ABB,"ABB to include Latin, Greek or a Modern Foreign Language.",32,"6,5,5 including 32 points overall. See below for full information."
K0497,https://www.birmingham.ac.uk/undergraduate/courses/law/international-law-globalisation.aspx,LLB,International Law and Globalisation,AAA,AAA,32,"6,6,6 including 32 points overall."
K0498,https://www.birmingham.ac.uk/undergraduate/courses/biosciences/biochemistry-international-year.aspx,BSc,Biochemistry with an International Year,AAA,AAA To include Chemistry + 1 from Maths / Further Maths / Statistics / Biology / Physics ,32,"6,6,6 + 1 from Maths: Analysis and Approaches / Maths: Applications and Interpretation/ Statistics / Biology / Physics  at Higher Level with a minimum of 32 points overall"
K0499,https://www.birmingham.ac.uk/undergraduate/courses/biosciences/biological-sciences-international-year.aspx,BSc,Biological Sciences with an International Year,AAA,AAA including Biology / Human Biology + 1 from Chemistry / Physics / Maths / Further Maths / Statistics / Geology / Geography / Psychology,,"6,6,6 including Biology / Human Biology + 1 from Chemistry / Physics / Maths: Analysis and Approaches / Maths: Applications and Interpretation/ Statistics / Geology / Geography / Psychology "
K0501,https://www.birmingham.ac.uk/undergraduate/courses/psychology/human-neuroscience-bsc.aspx,BSc,Human Neuroscience,AAA,AAA including Biology / Human Biology,32,"6,6,6  at Higher Level with a minimum of 32 points overall"
K0502,https://www.birmingham.ac.uk/undergraduate/courses/jointhonours/modern-languages-and-music.aspx,BA,Modern Languages and Music,ABB,ABB see below for full information.,32,"6,5,5 to include 32 points overall. See below for full information."
K0503,https://www.birmingham.ac.uk/undergraduate/courses/business/business-management-with-marketing.aspx,BSc,Business Management with Marketing,,"6,6,5 32 points overall",,"DDD in Business, Applied Science, or Enterprise and Entrepreneurship"
K0504,https://www.birmingham.ac.uk/undergraduate/courses/gees/environmental-science-msci.aspx,MSci,Environmental Science,AAB,AAB Including 1 Required Science,32,"6,6,5 32 points overall. Including 1 Required Science"
K0505,https://www.birmingham.ac.uk/undergraduate/courses/gees/environmental-science-abroad.aspx,BSc,Environmental Science with Year Abroad,ABB,ABB Including 1 Required Science,32,"6,5,5 32 points overall."
